Price,Name
$2.99,"the invisible life of addie larue, ЕВООК new original high quality, updated 2020"
$34.65,Aesop's Fables Aesop Illustrated By A. Rackham Sealed Leather Bound Collectible
$4.99,Morphy Chess Masterpieces By Reinfeld HB Chess Book
$20.00,Most famous bracelet in the world
$4.89,Selected poetry of W  H  Auden
$31.96,Jesus (Hardback or Cased Book)
$1.99,CCNA 200-301 50 GB AUG 2020 Cisco Video/Official Books/Exam Dumps/Licences
$20.37,"Cambridge Star Atlas 2000.0 by Tirion, Wil Hardback Book The Fast Free Shipping"
$8.99,Introduction to Thematic Cartography
$4.49,The Complete Idiots Guide to Trouble-Free Home Re
,BRITISH RIFLE GRENADES OF THE GREAT WAR
$5.77,"Warman's Star Wars Field Guide by Wells, Stuart W., III"
$3.99,Good Condition Furiously Happy: A Memoir by Jenny Lawson HC 2015
$4.49,Rebecca and Ana (American Girl (Quality))
$4.49,CSS: The Definitive Guide by Eric A. Meyer 
$2.21,✅365 Days + This Day + Another 365 days by Blanka Lipinska (English version)✅
$4.49,Sonic Wind  The Story of John Paul Stapp and How a Renegade Doctor Be
$6.74,"My Life in and Out of the Rough by John Daly (2006, Hardcover) FREE SHIPPING"
$4.49,The Black (Morpheus Road)
$4.49,One Year through the Bible by David R. Veerman 
$4.49,The Fifty Greatest Conspiracies of All Time  History s Biggest Myster
$17.76,Sasinowski M-Heir Of Ra BOOK NEW
$19.40,Sasinowski M-Legacy Of Ra BOOK NEW
$4.49,Dead Time  A Hank Fallon Western 
$6.62,How to Win Friends &amp; Influence People
$17.73,The Value Of Time
$4.49,"Battle of the Dum Diddys (Rotten School, No. 12) by R.L. Stine "
$4.49,PRETTY GOOD JOKE BOOK 2nd ED (Prairie Home Compani
$15.12,"The Wire in the Blood (Tony Hill and Carol Jordan, Book 2) by McDermid New+-"
$7.50,Nightmares in the Sky: Gargoyles and Grotesques
$4.49,The Fortune of War (Aubrey / Maturin) by Patrick OBrian 
$7.53,Titans of the Rising Sun - Yamato Class Battleships of World War II Book
$4.49,Philadelphia Museum of Art: Handbook of the Collec
$26.67,"The Nature Notes of an Edwardian Lady (Country Dia... by Holden, Edith Paperback"
$15.44,How to Get an Asian Girlfriend by Derek Strong (English) Paperback Book Free Shi
$4.49,B000BMWN4I The Complete Everyday Cookbook
$20.18,The Graphic Design Reference & Specification Book: Everything Graphic Designers
$3.49,"Die with Zero by Bill Perkins (P'.Ð,'F, 2020)"
$4.49,Battlestations! (Star Trek: The Original Series)
$4.89,Rebecca to the Rescue (American Girl (Quality))
$4.49,A New Earth: Awakening to Your Lifes Purpose
$5.01,Escape from the Carnival of Horrors (Give Yourself Goosebumps) by R. L. Stine 
$4.49,Eat and Stay Slim
,Winter Story_Brambly Hedge Pb (UK IMPORT) BOOK NEW
$14.97,The World of Van Gogh from Time Life Library of Art
$4.89,Catechism of the Catholic Church
$5.56,My Passion for Design by Barbra Streisand 
$4.89,A Woman of Substance
$5.38,The Home Stretch
$5.02,Astronomy: A Visual Guide
$4.49,The Little Drummer Girl
$16.95,Genuine Leather Bible Cover
$26.00,Art History Portables Book 6 by Michael W. Cothren and Marilyn Stokstad 5th edtn
$22.68,Earl Scruggs and the 5-String Banjo: Revised and Enhanced Edition (Paperback or
$4.89,Basic River Canoeing
$4.89,National Geographic Bird Watcher s Bible - A Complete Treasury
$4.49,The Heart of Rock & Soul by Dave Marsh 
$4.89,"A Short Guide to Writing About Art, 9th Edition (T"
$5.22,Java  How to Program  8th Edition
$4.49,The Fountainhead: 50th Anniversary Edition
$169.95,C S Forester' Hornblower Saga 11 Books Series Collection Set - BRAND NEW
$24.99,BEVERLY HILLBILLIES 1993 TV Show BOOK 1st Edition AUTOGRAPHED Signed STEPHEN COX
$4.49,Ex-KOP
$4.49,Taste of Home Bake Shop Favorites: 383 Reader Reci
$5.17,The Key to Rebecca by Ken Follett 
$5.61,Sing My Way Home: Voices of the New American Roots
$11.31,Photosynthesis by Rabinowitch
$50.00,The WORLD of ART Time Life Books~CompleteSet of 24 + American Modern Art
$4.49,Goodnight from London: A Novel
$1.99,"   300,000 PLR Articles, 2,000 E-books + More"
$5.50,Tales from the Buffalo Bills
$3.49,B0028NAO6C Shoeless Joe
$4.49,The Italians by Luigi Barzini 
$14.77,Little Women by Louisa May Alcott  Illustrated Brand New Collectible Hardcover
$19.50,A boy who grew up eating nightmare It's Okay to Not Be Okay Picturebook 사이코지만괜찮아
$4.49,"Lives of the Artists, Vol. 2"
$4.00,Heroes' Feast (Dungeons & Dragons): The Official D&D Cookbook
$30.00,Gulag archipelago / Gulag Archipelago Volume 2 / 1st edition paperbacks
$4.49,The Fall of Berlin 1945 by Antony Beevor 
$4.49,Walleye wisdom
$4.49,Seashells of North America: A Guide to Field Ident
$4.89,The Last Victim: A True-Life Journey into the Mind
$4.49,The Picture of Dorian Gray by Oscar Wilde 
$24.23,HIROSHIGE One Hundred Famous views of Edo by Taschen NEW HARDCOVER
$3.99,High-Yield Behavioral Science
$4.49,Bronze Dragon Codex (The Dragon Codices) by R.D. Henham 
$4.09,"The Cheater (Fear Street, No. 18) by R. L. Stine"
,Saunders Comprehensive Review for the NCLEX-RN(R) Exam 8th Edition
$99.90,Fatawa Islamiyah (Islamic Verdicts) (8 Volume Set)
$4.49,Michelangelo and the Popes Ceiling by Ross King 
$4.49,House of Earth: A Novel by Woody Guthrie 
$3.99,The Heretic's Daughter by Kathleen Kent
$4.09,A History of Christianity Vol. 1 : Beginnings to 1500 by Kenneth S. Latourette
$4.49,Shedd Aquarium by Karen Furnweger 
$32.94,Breaking Free from Depression: Pathways to Wellness by Jesse H. Wright (English)
$4.49,Red Dragon Codex (Deckle Edge) (The Dragon Codices) by R.D. Henham 
$5.50,Florida's List of Protected Plants in Words and Pictures
$4.49,The Puzzle Palace
$9.99,The Neuroscience of Emotion A New Synthesis by Ralph Adolphs
$22.93,Rage By Bob Woodward - Donald Trump NEW HARDCOVER Sept 2020
$4.49,The Blooding by Joseph Wambaugh 
$7.68,"Vietnam, The Decisive Battles"
$7.00,Master and God
$35.95,Beverley Nichols : A Life by Bryan Connon 2005 Hardcover New
$12.46,How to Repair Home Laundry Appliances
$12.63,Dutch Cooking (The Netherlands Cookbook) by Heleen A. M. Halverhout Book The
$6.08,The Art of Glen Loates
$13.53,Bobby Fischer s Chess Games
,"Days with the Composers, 1930's hardcovers"
$8.45,"Steam Yacht Varuna, Brand New, Free shipping in the US"
$13.99,"Straw Dogs : Thoughts on Humans and Other Animals, Paperback by Gray, John, L..."
$4.49,Q&amp;A a Day: 5-Year Journal
$52.99,"KING JAMES VERSION (KJV), RAINBOW STUDY BIBLE, BLACK LEATHER with INDEX "
$150.00,Signed ~THE HOT ZONE A Terrifying True Story Richard Preston HCDJ First Edition!
$4.09,Endurance : Shackleton's Incredible Voyage by Alfred Lansing
$4.89,Haida: Their Art and Culture
$8.86,Enough By Helen Roseveare
$125.00,Day Trading Joe Ross New Hard cover English edition
$4.49,Theodore Boone: The Activist by John Grisham 
$4.49,Tumbling by Caela Carter 
$4.49,Seashells of the World - A Guide to the Better-Known Species (Golden Nature Guid
$13.49,The Trapper's Bible: The Most Complete Guide on Trapping and Hunting Tips Ever (
$5.79,Quilts of Illusion
$5.80,Waterfowl Illustrated
$4.49,A History of the Indians of the United States (The
$4.25,Care &amp; Repair of Furniture
$4.59,"The Interpreters Dictionary of the Bible, An Illu"
$4.89,That Quail Robert
$6.75,Arnold Ehret RATIONAL FASTING 1971 paperback collector's edition 
$5.99,Executive style
$4.49,Summer Places
$4.49,Rod: The Autobiography by Rod Stewart 
$9.35,Story of a Soul: The Autobiography of St. Therese of Lisieux
$23.99,B000MEB56C Mishneh Torah  Sefer Shoftim
$4.89,Experience by Martin Amis 
$4.49,The Epic of Gilgamesh
$4.49,O-Zone
$4.22,"The Wim Hof Method Activate Your Potential, Transcend Your Limits🔥✅✅✅"
$4.49,Black Dragon Codex (The Dragon Codices) by R.D. Henham 
$17.45,"Begin the Begin : R.E.M.'s Early Years, Paperback by Lurie, Robert Dean, Like..."
$16.99,The Theory of Social Revolutions by Brooks Adams (English) Paperback Book Free S
$22.37,"The Ultimate Guide to U.S. Army Survival: Skills, Tactics, and Techniques (Paper"
$4.89,American Zoos
$10.95,SCOTTISH FOLKLORE LEGENDS - 180 RARE BOOKS ON DVD - SCOTLAND HISTORY MYTHOLOGY 5
$10.49,"The Complete Illustrated Works of Lewis Carroll by Carroll, Lewis Hardback Book"
$94.95,Book: The Lee-Enfield by Ian Skennerton- Signed Edition
$4.49,Luke s Fate  Star Wars 
$24.12,Hekate Soteira : A Study of Hekate's Role in the Chaldean Oracles and Related...
$30.84,Sexual Secrets: Twentieth Anniversary Edition: The Alchemy of Ecstasy (Paperback
$121.90,"Principles of Virology, 2 Volume Set (ASM Books)"
,"The Negro Motorist Green-Book: 1940 Facsimile Edition, Like New Used, Free sh..."
$2.99,return to virgin river by robyn carr
$13.84,Pictures From a Distant Country: Seeing America Through Old Paper Money
,DALLAS DONALD SHOTGUNS BOOK BRITISH SPORTING GUN & RIFLE hardback BARGAIN new
$24.89,"Buffy the Vampire Slayer Season 12 Library Edition, Hardcover by Gage, Christ..."
$43.28,Shaping the World: Sculpture from Prehistory to Now by Antony Gormley (English) 
,450 RARE IRISH HISTORY GENEALOGY BOOKS on USB - IRELAND FAMILY TREE ANCESTRY 296
$34.99,Nutcracker Christmas Tales New Sealed Illustrated Leather Bound Deluxe Hardback
$5.74,Collectors  Paperweights  86
$19.73,Winnie the Pooh by A. A. Milne Illustrated by Shepard Collector's New Hardcover 
$4.49,A Million Little Bricks  The Unofficial Illustrated History of the LE
$25.87,In the Footsteps of the Russian Snowman (Paperback or Softback)
$4.49,"Black House: A Novel by Stephen King, Peter Straub "
$19.37,The Rising Tide of Color: Against White World Supremacy by T. Lothrop Stoddard (
$6.43,Evolutionary Analysis
$7.62,"Harry Potter and the Chamber of Secrets (Book 2) by Rowling, J. K. Paperback The"
$17.98,Herbal Tarot Deck
$4.09,"Skeleton Canyon (Joanna Brady Mysteries, Book 5) by Jance, J.A."
$6.00,Motorcycle Journeys Through North America : A Guide for Choosing and Planning...
$4.89,Playing Blackjack As a Business
$20.87,Game of Thrones: The Poster Collection (Paperback or Softback)
$8.09,The Elf on the Shelf: A Christmas Tradition
, -My Little Pony: Glory And Illustrated Book (UK IMPORT) BOOK NEW
$7.95,Lot of 3 - Major Genealogical Record Sources LDS Mormon UK - Welsh Patronymics 
$11.84,Gourmet s Old Vienna Cookbook  A Viennese Memoir
$4.49,Beloved by Toni Morrison 
$24.99,Midnight Sun(Twilight) by Stephenie Meyer | Hardback UK Edition
$4.49,Dont Sweat the Small Stuff . . . and Its All Small Stuff: Simple Ways to Keep 
$2.99,Christmas Cupcake Murder: A Festive & Delicious Ch... by Joanne Fluke (P.Ð.Ƒ)
$12.33,Michael Jackson: A Life in Music (Paperback or Softback)
$9.95,Fundamentals of Cosmobiology. A Correspondence Study. Eleonora Kimmel (1972) SC
$16.88,"Unleashed : The Story of Tool, Paperback by McIver, Joel, Brand New, Free shi..."
$4.89,The Great One: The Complete Wayne Gretzky Collection
$4.09,Language and Woman's Place by Robin Lakoff
$107.09,"Forgotten Fantasy : Sunday..., Hardcover, Brand New, Free shipping in the US"
$4.49,Entertaining
$10.00,Spectacular Ireland Coffee Table Book -  very large
$5.61,Dr. Bob and the Good Oldtimers
$3.99,✔️Pornhub PREMIUM LIFETIME AUTO RENEW | FAST DELIVERY ✔️
$4.49,Our Family Tree  A History of Our Family
$2.99,The Last Kings of Shanghai by Jonathan Kaufman
$4.09,"The Complete Life's Little Instruction Book by Brown, H. Jackson, Jr."
$10.00,"AMERICAN VICTORIAN COTTAGE HOMES By Palliser & Co., Dover Edition"
$15.35,[NEW] A Divine Revelation Of Hell by Mary K. Baxter
$4.41,Against All Odds : The Untold Story of Canada's Unlikely Hockey Heroes
$2.69,A TIME FOR MERCY by John Grisham
$4.49,An Hour With Jesus
$4.49,Cell: A Novel by Stephen King 
$19.99,Merry Robin Hood by H. Pyle New Sealed Illustrated Leather Bound Gift Hardback
$4.49,The Messiah
$4.49,Diabetic Dream Desserts
$4.89,Tea with Jane Austen
$9.99,All American History Vol 1 Student Reader
$139.95,Time Life Books: The Old West Series ~ Complete 26 Volumes + Master Index mn853
$4.99,Obama An Intimate Portrait by Pete Souza P-F Eß00K ✔
$38.95,Holy Bible Crossway English Standard Version Genuine leather ESV Very Nice
$64.95,Poor Charlie's Almanack The Wit and Wisdom of Charles T Munger 3rd Ed. BRAND NEW
$3.30,The Four Agreements: A Practical Guide to Personal Freedom by Don Miguel Ruiz
$2.50,Admission Assessment Exam Review 4th Edition by HESI (P.Ð.Ƒ)
$4.49,Painting from the Source: Awakening the Artists S
$19.99,King Arthur And His Knights New Sealed Illustrated Leather Bound Gift Hardback
$31.94,The Real World of Jane Austen
