Price,Name
$8.99,1920s Flapper Gatsby Cocktail Dress Chiffon Wedding Party Evening Formal Dresses
$65.00,Jams World Hawaiian 🌺 Dress Rayon sz.L
,Gorgeous Topshop Silver Wrap Dress *Size 12*
,CREAM LACE DRESS BY PARASOL SIZE Small 8/10 USED
$56.89,Lilly Pulitzer 8 Sunkissed with Glow Janice Shift Dress
,Girls Tweed Dress
,Klass Collection Floral Print Fitted Dress  Size 14.
,Tunic dress xl
,Et Vous Multi Patterned Print Dress  Size 16.
$5.19,Sexy Lingerie Lace Dress Babydoll Women's Underwear Nightwear Sleepwear G-string
$22.77,Vintage Gothic Lolita Dress Women Loose Puff Sleeve Pure Color Princess Dresses
,Women Ladies Adult Harley Quinn Fancy Costume T-Shirt Halloween Plus Size Dress
$8.80,Fashion Sexy Backless Tight-fitting Halter Dress Cocktail Party Weeding Elegant
$14.95,Xhilaration Womens L Burgandy Boho Embroidered Festival Mini Dress NEW
,Stunning Ladies  Black Lace Evening Occasion  Dress From Next    Size 20
$0.99,Women Sexy Lingerie Lace Dress Underwear Babydoll Sleepwear G-string Bikini Lot
$39.00,Leopard Print Large Dress With Pockets & Floral Sleeves HoneyMe Size L NWT
$17.99,Liza Byrd Dress Sz L-  Coral Green Medallion Print Short Sleeve 100% Cotton Line
$55.00,New Young Fabulous Broke Yfb Blue Ombre Overlay Halter Maxi Dress Sz Medium $286
$86.25,Weekend MaxMara Womens Blue Cotton Floral Casual Wrap Dress 10 BHFO 9284
$11.97,Charlie Jade Purple Black Brown Sleeveless Dress WOMENS SIZE SMALL
,Wrap Dress Size 44 V Neck Bracelet Sleeve Zip Back Made in Italy
$58.99,Boden Wren Ponte Midi Dress w/Color Block Hem NWT Size 10P Black Pink 10 Petite 
$50.00,Matilda Jane Women's Light Rising High Low Green Floral Dress Size L Pockets 
$89.99,Johnny Was Medium Linen Wrap Dress Dessert Rose Embroiderd Bohemian
$289.00,HERVE LEGER Bandage Dress Long Gown Flared V Neck Metallic Silver Size S
$16.99,Beach Lunch Lounge Striped Shirt Dress Large Navy Blue White Long Sleeve Causal
$24.75,Zara Yellow Shift Dress XS 
$9.00,Papaya Floral Dress Medium Blue White
$12.00,Old Navy Womens Sleeveless Rayon Dress Hawaiian Floral Print Size  XS
$5.00,Banana Republic Maroon Abstract ruffled wrap  Dress With slip xs 0
,Gtpsy style dress by f & f size medium 12 14
,zara dress small
$15.99,MARC JACOBS IVORY COTTON SHORT SLEEVE BEIGE SILK OVERLAY DRESS SMALL
,M&S Smart Dress Size 12 Great Condition
$12.99,ZARA TRAFALUC Metallic Gold Black Stripe L/S Collar Dress Small S
$60.00,Elisa Cavaletti Daniela Dallavalle Shift Dress Grey And White .Size M
,LADIES PUSSYCAT TUNIC/DRESS TOP SIZE L 
$7.00,Speechless Green Brown White Psychedelic Sleeveless Dress Size Large
$12.99,Chic Star Retro Mary Hildebrandt Frock Dress Plus Size 24 Red Cotton 3X
,Girl In Mind Dress Size 10 Black Stretch Fitted Skirt With Floral Sheer Lined 
$12.99,Pre-Owned Women's Nah Nah Dress Size 8 Black Sheer Formal Sexy
$15.83,"Windsor womens black and Pink Bodycon Sleeveless Dress, Womens Size Small"
$48.99,Cabi 5610 Striped White Blue Launch Maxi Dress Womens Sz M
,EXCELLENT CONDITION AX PARIS BLACK STRAPLESS MINI DRESS SIZE 8 
$10.00,Calvin Klein dress 8 women blue/white
,La redoute Maxi Dress 18
$5.99,CLIFFORD & WILLS BLACK NET/MESH OVER TAUPE LONG DRESS SIZE 4
$295.00,NWT $1200 J.Crew Silk Chiffon Ivory Wedding Dress with Beading
$14.99,db Yellow Link Print Fit  and Flare Sleeveless Dress Sz M/L
$26.99,Coolibar Sun Protection Tunic Dress Cover Up Size Small  S Pink Pattern UPF 50
$12.00,Free People Lace Dress One Shoulder Size L
$13.00,Guess White Halter Dress Size 10
"$1,550.00",balmain dress 36
$10.00,Socialite White Black Striped A Line Dress With Pockets Large
,Ladies Soon blue Shift Dress size 16
$38.00,"New Wallis black floral midi dress sleeveles, size UK 12"
$4.99,Caslon Blue White Sleeveless Belted Ruffle Rayon Dress Sz L
,COCKTAIL DRESS UK 14 PINK BY SARA KELLY 💕  *10
$44.99,NWOT Italian Dress Grey Black Size XS Made in Italy
,Armani Slip Dress With Lace Detail 4-6
$4.00,NWT As U Wish NEW Black Chevron Size Small Sequin cocktail formal dress prom
$2.99,Bcbgeneration Black Sleeveless Lace Back Cut Out Dress Sz 2
,women Dress
,Joe Browns Dress Black Multi Floral Velour Lace Glitter Panel Dotty Sleeve UK18
$15.49,Bobbie Brooks Colorful T-shirt Dress Size S Small Soft NWT
,Rixo London Daisy Velvet Floral Dress Size XXS
,"h&m. black. women's dress. uk size 6. Satin look, round neck, party / cocktail."
$4.99,NWT Boohoo Sabra Emerald Green Floral Ruffle Dress Sz 12
,Ladies sleeveless Dress size 14 Apricot 
$9.15,Newborn Toddler Baby Girls Floral Print Romper Dress Bodysuits Ouftits Clothes
$32.00,Vince Camuto Sweater Dress Size Medium Striped Long Sleeve
$59.99,New ERIN Erin Fertherston Straight Dress White Sequence Lining Sleeveless SZ 10
$65.00,NWT Modcloth Blue Floral Formal Full Length Maxi Dress
$20.00,J crew Mercantile Women’s Maxi Dress Size 2 Floral Tiered Lined Pink 
$39.99,Athleta Coral Paisley Print Stretch Ruching Wrap Athletic Dress Size L
$0.99,Ruby Rox Size 5 Black Strapless Evening Party Dress 
,SIZE 18 BLACK/WHITE CLASSY DRESS FROM GEORGE  worn once
,Ladies Round Neck Long Sleeved Dress Green /Black Dress Size S Glamour
$49.96,Vintage 90s Sostanza Plus Size Dress 22W Floral Cottagecore 
,bodycon dress
$13.99,Women Black Dress Mori Girl Puff Sleeve Korean Casual Loose Peter Pan Collar
$15.50,S.L. Fashions Size 16 Stretch Bodice Dress
$49.99,Kate Spade NY Sleeveless Ponte Fit & Flare Solid Black Dress Size 6 
,Great Plains Black Wrap Style Dress M
$2.99,NEW NWT OPEN BACK XHILERATION PLUM LACY DRESS WOMENS SIZE MEDIUM 10/12
$75.00,Burent Orange Long Dress With Beads SUE WONG SIZE 2
,helmut lang Silver Sequin Mini Dress S
$4.47,Women Spaghetti Strap Bodycon Mini Dress Sexy Party Club Wear Summer Short Dress
$12.00,Women Elegant Fashion O-Neck Knee Length Short Sleeve Retro Floral Print Dress
$4.99,Lumiere Large Multicolored Orange Short Dress NWT
$9.99, Christmas Dress Grace Karin Sleeveless Christmas dress Red Black size Large
$39.99,NEW!! Free People: layered Gray Dress  NWT (Size Small) $128 Long Sleeve Rayon
$8.99,Calvin Klein Women Long Active Dress. Size Small
,TFNC London Black And Gold Dress Size 8
$69.96,Vintage AGB Black Velvet Maxi Dress L Mandarin Collar
,KAREN MILLEN Dress Black Size 8
$20.00,DESIGNER MICHAEL KORS DRESS SIZE S
$20.90,NWT dRA M White Embroidered Nathalie Bohemian Mini Dress
,Joules Imelda Women's Jersey Woven Mix Dress- SS20
$7.59,Women Dress Gradient Color Long Sleeve Sexy Club Bodycon Mini Dresses Casual
,H&m Jersey Maxi Dress Brand New Red Size Small 
,Missguided Lace Black Dress Tie Neck
,abaya dress
,PEACOCKS DRAWSTRING WAIST DRESS SIZE 16 #NL
$10.00,WD NY BLACK & OFF WHITE DRESS SIZE 8 Button Front
$11.75,J Crew A Line Ponte Dress Red Size 0
$10.00,Unbranded Dress Sleeveless Cowl Neck Gold Silver Purple Metallic Size 6 S
$10.00,Vintage 80s All That Jazz Blue Velvet Dress Small/Medium
$35.00,Boden Size 8 US Green & Navy Dark Blue Belted Midi Wool Knit Sweater Fall Dress
,Papaya Petite Denium Dress Size 10
,Forever 21 Navy Dress/top Size S 
,Lee Mathews Eve Black Silk Georgette v-neck long sleeve dress originally $989
$54.86,Women's Almatrichi Madrid Dress Chevron Boho Ethnic Exotic Tribal Size 42 L
$9.99, womens sparkle dress size 2X Holiday Party  RED metallic
$20.00,BCBG Maxazria dress XS
,Pretty Little Thing Cut Out Waist Bodycon Dress Size 8 
$25.00,SCOTT McCINTOCK SIZE 12 BLACK PARTY DRESS WITH SPARKLIND TOP
$45.00,Lilly Pulitzer dress size 0
$11.89,Evening Dress Sexy Cocktail US Mini Women Party Bandage Long Sleeve Club Bodycon
$26.00,J crew mercantile Knitted Tweed Dress Size 4 Black And White
,Papaya SOLD OUT Black Blue Yellow Short Sleeve Floral Frill Wrap Dress. Uk 16
,Dorothy Perkins Red Floral Embossed Dress  Size 12.
,NEW⭐️TFNC WHITE DRESS⭐️Shoulder BNWT Size Small Medium
$0.99,Large Blue Long Sleeve Fit & Flare Dress Elastic Waist Crochet Detail Bohemian
,EXCELLENT CONDITION NEW LOOK PURPLE PRINT DRESS SIZE 10 
,Striped Tunic Dress - 3XL - Pastel Colours
$74.99,Escada Long Black Dress SZ 40 100% Silk Lining
$25.00,FashionNova “Forecasting You” MAXI DRESS TAUPE SZ M
$14.99,Talbots Petite 8 Navy & White Dandelion Puffs Sleeveless Dress
$9.95,Adult Kids Pokemon Pikachu Kigurumi Pajama Cosplay Christmas Costume Sleepwear
$30.00,J.Crew Collection Black & White sweater Dress sz S
$19.60,Matilda Jane Womans Lets Go Together Black Knit Dress Size M Medium NWT
$20.00,Jones Wear Dress Women White Pink Floral Sleeveless Formal Tea Dress Size 12
,Virgos Lounge Maxi Dress Embellished Size 8 Navy Blue 
,Black Silver Bodycon Dress Size S Small Black Party
$4.71,14 Colors Women Spaghetti Strap Bodycon Mini Dress Sexy Party Club Wear Dresses
$44.89,Lilly Pulitzer XS Spike the Punch Cassie Cotton Dress with Quarter Sleeves
,Asos gold drape front sequin Dress Size 16
$8.00,Shein Blue And White Striped Wrap Dress
$15.99,Eileen Fisher Women's Long Sleeve Fleece Lined Front Pockets Dress XS Gray
$9.95,PAS DE CALAIS DRESS WOMENS SIZE 36
$15.99,Max Studio Womens Black Sleeveless Floral Casual Dress Medium
$7.99,Divided Black Asymmetrical  Dress -size 8 - NWT
,Principles Floral Dress Size 14
,Ladies Summer Dress
$25.00,Zara black dress in Small
,Silver dress
$45.00,Lilly Pulitzer dress Size 2
$19.99,"Women's black cocktail dress, size 4"
$3.75,Lularoe Nicole Dress Size Small Light Solid Grey/ White Ringer Tee Trim
,DRESS BY BELLA BLU FLORAL PRINT. COTTON S/M *10
$35.00,Sequence dress Size Small
$45.99,LAUREN RALPH LAUREN Womens Landette V-Neck A-Line Dress Size 6 NWT $200
,NEXT Ladies Black dress -  Size 10
$20.00,Guess Dress Size 6
,Womens Dress Size 18 M&S Collection Nwt rrp £30
$20.00,GUESS dress size 2
$29.99,R&M RICHARDS WOMAN’S BLUE DRESS With Rhinestone Accent Short Sleeves Sz 16W NWT
$5.00,Betsey Johnson Black Solid Polyester Textured Shift Dress Sz 10
,H&M Pencil Dress
$3.50,Cherry Halter Rockabilly Black Summer Dress Size 3/4
$16.00,miley cyrus Bubble Dress
$34.99,Tommy Bahama Women's V Neck Linen Floral Dress Size M Beige Short Sleeve Tan
,Karen Millen Purple & Black Smart Dress Size 8
$5.99,KAREN SCOTT 3X DRESS
,COS Ladies dress
,Boohoo Ladies Pink Floral Tunic Or Mini Dress UK size 12
$29.99,R&M RICHARDS WOMAN’S BLUE PRINT LONG DRESS WITH SHRUG JACKET SIZE 18W NWT
,Navy & Blush Pencil Dress With Lace Detail Size 10
$80.00,sandro dress
$9.99,Rebecca Minkoff Black Polyester Fringe and Lambskin Dress Sz 12
$36.99,Boden black blue floral short sleeve dress size 6
$1.99,LuLaRoe Nicole Dress Size Large 25
$5.00,O’Neill Black Pink gray green Floral Dress Beach coverup xs 0
$21.23,Lands End Womens 3/4 Sleeve Dress Plus 3X Navy Blue Floral Cotton Knit 482038
,Salsa  ladies black and white stripped dress size s (8) in VGC
$65.00,Diane Von Furstenberg Wrap Red Black Classic Dress Size 14
$14.99,Forever 21 Blue A-Line Dress SIZE MEDIUM
$25.00,StellaLuxe One Shoulder Lace Dress
$1.99,LuLaRoe Nicole Dress Size Medium 11
$22.95,Lulus Women's Black Bell Sleeve Floral Swing Dress Size S
$6.50,fire los angeles dress Medium 
$12.50,NWT Women’s MAX EDITION Classy Gray Knit Stretch Dress side bow tie ¾ sleeve XL
$1.99,LuLaRoe Nicole Dress Size Large 26
$10.99,2pcs baby boys clothes cotton hoodied top+pants baby boys  Outfits gentleman
$8.00,Ann Taylor LOFT 3/4 Knit Sleeve Dress Size 0
$1.99,LuLaRoe Nicole Dress Size Medium 12
,white lace effect dress size 12
$395.00,NWT J.Crew Silk Wedding Dress 
,ANTHEA CRAWFORD FLORAL DRESS size 18 rrp $335 
,Debut Size 14 Dress Red Floral Print Womens Gown Never Worn
,M&S Collection 16 Dress
$0.99,Mossimo M Red and Orange Braided Strap Tank Maxi Dress 
,Pont Neuf Shirt Dress S-M
$0.99,Andrea Polizzi Women's Sleeveless Shift Dress Silver Size 8
,Warehouse Dress 10 Bottle Green
$76.00,Lilly Pulitzer Lillywood California 8 Shift Dress
$68.00,Lily Pulitzer Beach Fit & Flare Dress 8 New
$65.00,Jams World Hawaiian 🌺 Dress Rayon sz.L
$24.00,Hanna Anderson Women's L Large Coral Short Sleeve Casual Fall Tee Shirt Dress
$65.00,Jams World Hawaiian 🌺 Dress Rayon sz.L